{
  "contract": "record-event",
  "contractVersion": "1.0.0",
  "sessionId": "bundle.export-flow-0001",
  "seq": 11,
  "kind": "denied",
  "effectId": "effect.0005",
  "stepIndex": 2,
  "hostNs": 8130000000,
  "geometryEpoch": 0,
  "denied": {
    "reason": "not_foreground_safe"
  },
  "redactionPolicy": {
    "policyId": "redaction.default",
    "policyVersion": "1.0.0"
  }
}
